"keyword","pronums","protype","subtype","proname","protime","leaders","workloc","orgtype","provloc","systloc","result","resulttype","resultlevel"
"东南亚","18BZW150","一般项目","中国文学","东南亚汉文报刊小说文献整理与研究（新马卷1919—1949）","2018-06-21","李奎","山西师范大学","null","山西","教育部非在京直属/地方高校","东南亚汉文报刊小说文献整理与研究（新马卷 1919-1949）","专著","合格"
"东南亚","18BYY057","一般项目","语言学","“一带一路”倡议下东南亚国家语言政策与规划研究","2018-06-20","吴坚","华南师范大学","211高校","广东","教育部非在京直属/地方高校","1.东南亚国家语言政策与规划研究； 2.“一带一路”倡议下东南亚国家语言政策与规划研究","专著","良好"
"东南亚","18BMZ101","一般项目","民族学","东南亚民族研究学术史","2018-06-21","赵永胜","玉溪师范学院","null","云南","教育部非在京直属/地方高校","东南亚民族研究学术史","专著","良好"
"东南亚","18BKG003","一般项目","考古学","华南与东南亚晚更新世至全新世过渡期人类石器技术的共性与多样性研究","2018-06-20","李英华","武汉大学","985高校211高校","湖北","教育部非在京直属/地方高校","华南与东南亚晚更新世至全新世过渡期人类石器技术的共性与多样性","论文集","合格"
"东南亚","18BGJ077","一般项目","国际问题研究","“一带一路”在东南亚促进民心相通的路径与举措研究","2018-06-21","周方冶","中国社会科学院","null","社科院","中国社会科学院","null","null","null"
"东南亚","18BGJ068","一般项目","国际问题研究","“一带一路”倡议在东南亚实施的安全环境研究","2018-06-20","程晓勇","暨南大学","211高校","广东","教育部非在京直属/地方高校","1.“一带一路”在东南亚实施的安全环境； 2.《中美日与东盟经济合作解析》等学术论文","研究报告","合格"
"东南亚","18AYY025","重点项目","语言学","东南亚跨境拉祜语比较研究","2018-06-21","刘劲荣","云南民族大学","null","云南","教育部非在京直属/地方高校","1.东南亚跨境拉祜语比较研究； 2.东南亚跨境拉祜语数据库","专著,数据库","良好"
"东南亚","11BZJ032","null","null","东南亚孔教、孔子信仰研究","null","王爱平","华侨大学华文学院（厦门集美）","null","福建","高等院校、其它学校","东南亚孔教与儒教：印（尼）马新泰的考察研究","专著","良好"
"东南亚","13BYY090","null","null","海外华语语言生活状况调查及多媒体语言资源库建设——以东南亚主要国家为例","null","刘华","暨南大学华文学院/海外华语研究中心","211","广东","高等院校、其它学校","东南亚华人社区华语生活状况报告；东南亚多媒体语言资源库（网络版）","研报数据库","良好"
"东南亚","12XMZ083","null","null","东南亚少数族群融入主流社会问题研究","null","岳蓉","贵州师范大学历史与政治学院","null","贵州","高等院校、其它学校","东南亚少数族群融入主流社会问题研究","专著","合格"
"东南亚","11XGJ002","null","null","东南亚地区反洗钱多边合作机制研究","null","李春","云南警官学院刑事侦查学院","null","云南","高等院校、其他学校","东南亚反洗钱多边合作机制研究","研报","合格"
"东南亚","12CGJ019","null","null","东南亚国家来华留学生的文化差异问题研究","null","李涛","云南大学国际关系研究院东南亚研究所","211大学","云南","高等院校、其他学校","东南亚国家来华留学生的文化差异问题研究","研报","合格"
"东南亚","14CZW052","null","null","东南亚汉文报刊小说文献整理与研究（新马卷1815—1919）","null","李奎","山西师范大学","null","山西","高等院校、其他学校","东南亚汉文报刊小说文献整理与研究（新马卷1815-1919）","专著","良好"
"东南亚","11CZS053","null","null","明清时期中缅边境变迁对近代东南亚地缘政治的影响研究","null","段红云","云南大学西南边疆少数民族研究中心","null","云南","高等院校、其他学校","null","A","免于鉴定"
"东南亚","11BWW034","null","null","康拉德东南亚背景小说研究","null","祝远德","广西大学外国语学院","null","广西","高等院校、其他学校","null","AB","合格"
"东南亚","17ZDA163","重大项目","考古学","中国-东南亚铜鼓数字化记录与研究","2017-11-15","李富强","广西民族大学","null","广西","教育部非在京直属/地方高校","1.《中国-东南亚铜鼓数字化记录与研究》； 2.中国-东南亚铜鼓数字化服务平台[http://www.nngfkj.cn:82/]","null","良好"
"东南亚","11CZS055","null","null","东南亚兴化人的庙宇与仪式传统研究","null","郑莉","厦门大学人文学院","985大学、211大学","福建","高等院校","东南亚兴化人的庙宇与仪式传统","专著","良好"
"东南亚","17AGJ005","重点项目","国际问题研究","东南亚恐怖主义新态势及其对我国的影响及对策研究","2017-06-30","卢光盛","云南大学","211高校","云南","高等院校、其他学校","null","null","null"
"东南亚","17ASS007","重点项目","世界历史","非殖民化进程与东南亚冷战格局形成问题研究","2017-07-03","温荣刚","渤海大学","null","辽宁","教育部非在京直属/地方高校","非殖民化进程与东南亚冷战格局形成问题研究","专著","合格"
"东南亚","17BJY150","一般项目","应用经济学","“21世纪海上丝绸之路”背景下我国在东南亚南亚出境旅游效应研究","2017-07-03","张显春","桂林旅游学院","null","广西","教育部非在京直属/地方高校","1.研究报告《“21世纪海上丝绸之路”背景下我国在东南亚南亚出境旅游效应研究》； 2.论文集《“21世纪海上丝绸之路”背景下我国在东南亚南亚出境旅游效应系列研究》","研究报告","合格"
"东南亚","17BYY112","一般项目","语言学","华人移民对东南亚汉语传播影响的国别比较研究","2017-07-03","韩晓明","郑州大学","211高校","河南","教育部非在京直属/地方高校","1.华人移民对东南亚汉语传播影响的多维考察； 2.华人移民对东南亚汉语传播的影响研究论文集","专著","合格"
"东南亚","17BZJ025","一般项目","宗教学","当代东南亚华人基督教会的网络结构、社会资本及发展趋势研究","2017-07-03","张钟鑫","华侨大学","null","福建","教育部非在京直属/地方高校","当代东南亚华人基督教会的网络结构、社会资本及发展趋势研究","专著","优秀"
"东南亚","17XSS003","西部项目","世界历史","抗战时期在延安的东南亚华侨群体研究","2017-06-30","秦艳峰","延安大学","null","陕西","教育部非在京直属/地方高校","抗战时期东南亚华侨在延安","专著","合格"
"东南亚","17XYY022","西部项目","语言学","东南亚国家汉语政策与规划研究","2017-06-30","赵燕","昆明学院","null","云南","教育部非在京直属/地方高校","1.东南亚国家汉语政策与规划研究； 2.关于改善汉语在东南亚传播的几点建议","研究报告","合格"
"东南亚","17XZZ007","西部项目","政治学","战后东南亚民族国家建构与族群排斥研究","2017-06-30","王九龙","贵州大学","211高校","贵州","教育部非在京直属/地方高校","战后东南亚民族国家建构与族群排斥研究","专著","合格"
"东南亚","17CKG006","青年项目","考古学","东南亚青铜时代文化及其与中国文化交流互动研究","2017-07-03","陈晓倩","云南师范大学","null","云南","教育部非在京直属/地方高校","东南亚青铜时代文化及其与中国文化交流互动研究","研究报告","合格"
"东南亚","12CKG002","青年项目","考古学","华南与东南亚新石器时代的比较考古研究	","2012-05-14","陈洪波","广西师范大学历史文化与旅游学院","null","广西","高等院校、其他学校","华南与东南亚新石器时代的比较考古研究","专著","良好"
"东南亚","10BMZ040","null","null","东南亚哈尼族文化认同对中国边境地区构建和谐社会的影响研究","null","杨六金","红河学院国际哈尼/阿卡研究中心","null","云南","高等院校、其他学校","东南亚哈尼族文化认同对中国边境地区构建和谐社会的影响研究","研究报告","合格"
"东南亚","12CKG002","null","null","华南与东南亚新石器时代的比较考古研究","null","陈洪波","广西师范大学历史文化与旅游学院","null","广西","高等院校、其他学院","华南与东南亚新石器时代的比较考古研究","专著","良好"
"东南亚","16ZDA091","重大项目","null","东南亚安全格局对我实施“21世纪海上丝绸之路”战略的影响研究","null","曹云华","暨南大学","null","广东","null","null","null","null"
"东南亚","16CZJ013","青年项目","宗教学","东南亚华人基督教社团的发展转型及对新时期中国—东盟公共外交的影响探究","2016-06-16","张鹏","中央财经大学","非985","教育部","教育部在京直属高校","东南亚华人基督宗教社团与中国-东盟公共外交: 历史演进、系统建构与网络互动","专著","null"
"东南亚","16CYY019","青年项目","语言学","东南亚华族新生代多语能力与文化认同研究","2016-06-16","刘慧","暨南大学","非985","广东","教育部非在京直属/地方高校","1.东南亚华族新生代多语能力与认同调查研究； 2.柬埔寨华人家庭语言规划与华语传承调查研究","研究报告","合格"
"东南亚","16XGJ009","西部项目","国际问题研究","大理国与东南亚古国关系研究","2016-06-16","李魏巍","大理大学","非985","云南","教育部非在京直属/地方高校","大理国与东南亚古国关系研究","专著","null"
"东南亚","16XGJ004","西部项目","国际问题研究","云南与周边东南亚国家反恐警务执法合作机制研究","2016-06-30","刘爱娇","云南警官学院","非985","云南","高等院校、其他学校","null","null","null"
"东南亚","16BZW162","一般项目","中国文学","东南亚抗战的华文叙述研究","2016-06-16","苏永延","厦门大学","985","福建","教育部非在京直属/地方高校","东南亚抗战的华文叙述研究","专著","合格"
"东南亚","16BSS046","一般项目","世界历史","冷战视阙下的东南亚“区域主义”研究（1961—1991）","2016-06-16","张云","暨南大学","非985","广东","教育部非在京直属/地方高校","东南亚冷战与区域国别研究论文集","论文集","良好"
"东南亚","16BMZ097","一般项目","民族学","跨国视野下东南亚华裔与中国互动研究","2016-06-16","任娜","暨南大学","非985","广东","教育部非在京直属/地方高校","网络、资本与认同——跨国视野下东南亚华商与中国互动研究","专著","合格"
"东南亚","16BGJ051","一般项目","国际问题研究","东南亚华商助推“21世纪海上丝绸之路”建设的作用与路径研究","2016-06-16","黄伟锋","浙江工业大学","非985","浙江","教育部非在京直属/地方高校","东南亚华商助推“21世纪海上丝绸之路”建设的作用与路径研究","研究报告","合格"
"东南亚","16BGJ017","一般项目","国际问题研究","冷战后美国、日本对东南亚的援助及对我国的启示研究","2016-06-16","陈莹","暨南大学","非985","广东","教育部非在京直属/地方高校","人类命运共同体视域下中国对外援助的创新与超越——基于中美日对东南亚援助的比较研究","研究报告","合格"
"东南亚","16BFX191","一般项目","法学","“一带一路”战略下东南亚地区工程承包PPP融资模式法律问题研究","2016-06-16","罗传钰","广西大学","非985","广西","教育部非在京直属/地方高校","“一带一路”战略下东南亚地区工程承包PPP融资模式法律问题研究","研究报告","无（免于鉴定）"
"东南亚","16BFX190","一般项目","法学","“一带一路”沿线东南亚若干国家国际民商事争议解决制度研究","2016-06-16","欧福永","湖南师范大学","非985","湖南","教育部非在京直属/地方高校","“一带一路”沿线东南亚若干国家国际民商事争议解决制度研究","专著","无（免于鉴定）"
"东南亚","16BFX189","一般项目","法学","中国与南亚、东南亚国家境外追逃追赃的国际刑事司法合作研究","2016-06-16","高巍","云南大学","非985","云南","教育部非在京直属/地方高校","中国与南亚、东南亚国家境外追逃追赃刑事司法合作研究","专著","无（免于鉴定）"
"东南亚","16AZJ001","重点项目","宗教学","“一带一路”沿线东南亚国家的宗教治理经验及管理模式研究","2016-06-16","郑筱筠","中国社会科学院世界宗教研究所","null","社科院","中国社会科学院下属研究所","“一带一路”沿线东南亚国家的宗教治理经验及管理模式研究","专著","无（免于鉴定）"
"东南亚","16AYY018","重点项目","语言学","东南亚苗语志","2016-06-16","余金枝","云南师范大学","非985","云南","教育部非在京直属/地方高校","东南亚苗语志","专著","优秀"
"东南亚","15ZDA064","重大项目","null","东南亚安全格局对我国家安全战略影响及对策研究","2015-07-31","李晨阳","云南大学","null","云南","高等院校、其他学校","null","null","null"
"东南亚","09CZW069","青年项目","中国文学","多元混融中的白族文学--白族文学与东南亚、印度、汉族文学的关系研究","2009-06-04","董秀团","云南大学人文学院中文系","211大学","云南","高等院校、其他学校","null","null","null"
"东南亚","11CGJ005","青年项目","国际问题研究","东南亚国家处理海域争端的方式研究","2011-07-01","邵建平","云南大学国际关系研究院","211大学","云南","高等院校、其他学校","null","null","null"
"东南亚","08BMZ032","一般项目","民族问题研究","东南亚华族与其他移民族群国家认同、族别认同的比较研究","2008-06-04","郭玉聪","厦门大学南洋研究院","211大学、985大学","福建","高等院校、其他学校","东南亚华族与其他移民族群国家认同、族别认同的比较研究","研究报告","良好"
"东南亚","15XSS004","西部项目","世界历史","19世纪英国在东南亚的海洋政策研究","2015-06-16","王本涛","广西师范大学","非211大学、非985大学","广西","教育部非在京直属/地方高校","19世纪英国在东南亚的海洋政策研究","专著","null"
"东南亚","15BZZ005","一般项目","政治学","比较政治学视角下东南亚国家政治发展中的族际整合研究","2015-06-16","赵海英","河北师范大学","非211大学、非985大学","河北","教育部非在京直属/地方高校","比较政治学视角下东南亚国家政治发展中的族际整合研究","研究报告","null"
"东南亚","15BZS121","一般项目","中国历史","华南与东南亚间的侨批网络与社会互动研究（1911-1949）","2015-06-16","陈丽园","广东财经大学","非211大学、非985大学","广东","教育部非在京直属/地方高校","华南与东南亚间的侨批网络与社会互动研究（1911-1949）","专著","null"
"东南亚","15BSS040","一般项目","世界历史","二战后东南亚区域合作起源与演变研究（1945-1967）","2015-06-16","郑先武","南京大学","985大学、211大学","江苏","教育部非在京直属/地方高校","二战后东南亚区域合作起源与演变研究（1945-1967）","专著","null"
"东南亚","15BSH069","一般项目","社会学","中国矿业企业在东南亚经营中的社会责任问题研究","2015-06-16","李彦龙","云南省委党校","null","云南","各级党校","null","null","null"
"东南亚","15BMZ071","一般项目","民族学","东南亚华人眼中的中国","2015-06-16","梁茂春","暨南大学","211大学","广东","教育部非在京直属/地方高校","东南亚华人眼中的中国","研究报告","null"
"东南亚","14FGJ005","后期资助项目","国际问题研究","美国重返东南亚的同盟战略研究","2014-12-01","朱陆民","湘潭大学","null","湖南省","高等院校、其他学校","null","null","null"
"东南亚","14AZD069","重点项目","民族学","东南亚华人跨国流动与海上丝绸之路的文化交流研究","2014-11-05","麻国庆","中央民族大学","0","教育部","教育部在京直属高校","东南亚华人跨国流动与海上丝绸之路的文化交流","专著","0"
"东南亚","14CZW052","青年项目","中国文学","东南亚汉文报刊小说文献整理与研究（新马卷1815—1919）","2014-06-15","李奎","山西师范大学","非985非211","山西","高等院校、其他学校","null","null","null"
"东南亚","14AZJ007","重点项目","宗教学","东南亚华文宗教碑铭的搜集、整理与研究","2014-06-11","黄海德","华侨大学","非985非211","福建","教育部非在京直属/地方高校","东南亚华文宗教碑铭的搜集、整理与研究","专著","null"
"东南亚","14BMZ043","一般项目","民族学","东南亚民族国家建构的历史基础、目标构想与民族整合进程研究","2014-06-11","何平","云南大学","211非985","云南","教育部非在京直属/地方高校","东南亚民族国家建构的历史基础、目标构想与民族整合进程研究","专著","null"
"东南亚","14BZS084","一般项目","中国历史","明清时期中国与东南亚的海参、燕窝和鱼翅贸易研究","2014-06-11","冯立军","厦门大学","211且985","福建","教育部非在京直属/地方高校","明清时期中国与东南亚海参、燕窝和鱼翅贸易研究","专著","null"
"东南亚","14BWW060","一般项目","外国文学","东南亚裔美国小说研究","2014-06-11","张燕","桂林电子科技大学","非985非211","广西","教育部非在京直属/地方高校","东南亚裔美国小说研究","专著","null"
"东南亚","14CYY043","青年项目","语言学","广西各语言与东南亚语言共享特征的区域类型学研究","2014-06-11","覃东生","广西大学","211非985","广西","教育部非在京直属/地方高校","广西各语言与东南亚语言 共享特征的区域类型学研究","专著","null"
"东南亚","14XYY006","西部项目","语言学","东南亚英语地位嬗变与国家文化身份重塑研究","2014-06-13","陈兵","广西大学","211非985","广西","教育部非在京直属/地方高校","东南亚英语地位嬗变与国家文化身份重塑研究","专著","null"
"东南亚","14BSS014","一般项目","世界历史","东南亚三国（印度尼西亚、菲律宾、泰国）华人文化重构研究","2014-06-15","姜兴山","福建师范大学","非985非211","福建","高等院校、其他学校","null","null","null"
"东南亚","14BMZ104","一般项目","民族学","中国壮锦与东南亚相关织锦的综合研究","2014-06-11","吴伟峰","广西壮族自治区博物馆","null","广西","其他","中国壮锦与东南亚相关织锦的综合研究","研究报告","null"
"东南亚","14AYY011","重点项目","语言学","东南亚汉语传播的国别比较研究","2014-06-11","吴应辉","中央民族大学","211且985","高校","高等院校、其他学校","《东南亚汉语传播的国别比较研究》","论文集","null"
"东南亚","13XGJ009","西部项目","国际问题研究","美国战略东移对中国与东南亚关系的影响及我国对策研究","2013-06-10","杨亚非","广西社会科学院","null","广西","省、市社会科学院","null","null","null"
"东南亚","13CZJ029","青年项目","宗教学","宗教人类学视域下东南亚华人庙宇跨境文化互动研究","2013-06-10","陈碧","玉林师范学院","null","广西","高等院校","null","null","null"
"东南亚","13BYY094","一般项目","语言学","东南亚英语口语语料库的研制与英语变体研究","2013-06-10","纪可","广西大学","211大学","广西","高等院校","null","null","null"
"东南亚","13CSS030","青年项目","世界历史","日本对东南亚经济外交中的美国因素研究（1945-1972）","2013-06-10","徐建华","深圳大学","null","广东","高等院校","null","null","null"
"东南亚","13CMZ057","青年项目","民族问题研究","东南亚的庇护主义与华侨华人群体研究","2013-06-10","彭慧","华中师范大学","211大学","湖北","高等院校","null","null","null"
"东南亚","13BSS015","一般项目","世界历史","东南亚海上冲突与合作研究（1930—2012）","2013-06-14","李昌新","江西师范大学","null","江西","教育部非在京直属/地方高校","东南亚的海上冲突与合作1930-2017","专著","null"
"东南亚","99BMZ017","一般项目","民族问题研究","全球化进程中的中国及东南亚傣泰民族文化多样性比较研究","1999-07-01","郑晓云","云南省社会科学院","null","云南","省、市社会科学院","全球化进程中的中国与东南亚傣族民族文化多样性比较","专著","良好"
"东南亚","98EZS001","null","中国历史","东南亚海外潮人研究","1998-05-01","冷东","汕头大学东南亚研究中心","null","广东","高等院校、其他学校","东南亚海外潮人研究","专著","null"
"东南亚","98EZJ001","null","宗教学","华人宗教与东南亚现代化","1998-05-01","张禹东","福建华侨大学社会科学系","null","福建","高等院校、其他学校","华人宗教与东南亚现代化","null","null"
"东南亚","98BZW027","一般项目","中国文学","东南亚华文文学比较研究","1998-05-01","饶芃子","暨南大学中文系","211大学","广东","高等院校、其他学校","东南亚华文文学比较研究","null","null"
"东南亚","98BJY061","一般项目","应用经济","东南亚金融风波及我们的对策","1998-05-01","刘海藩","中共中央党校","null","党校","各级党校","中国金融问题风险和化解","专著","null"
"东南亚","98BJY060","一般项目","应用经济","东南亚金融风波与我国金融市场开放问题研究","1998-05-01","潘正彦","上海社会科学院部门经济研究所","null","上海","省、市社会科学院","东南亚金融风波与我国金融市场开放问题研究","研究报告","null"
"东南亚","98BJY059","一般项目","应用经济","东南亚金融风波对我国保险业的影响与对策研究","1998-05-01","李中杰","郑州大学经贸管理系","211大学","河南","高等院校、其他学校","东南亚金融风波对我国保险业的影响与对策研究","null","null"
"东南亚","97CSS001","青年项目","世界历史","东南亚国家华人与当地民族的关系","1997-04-15","李一平","厦门大学历史研究所","985大学、211大学","福建","高等院校、其他学校","东南亚国家华人与当地民族的关系","null","null"
"东南亚","97CGJ001","青年项目","国际问题研究","香港回归对香港与东南亚关系的影响及对策建议","1997-04-15","吴崇伯","厦门大学南洋研究所","985大学、211大学","福建","高等院校、其他学校","香港回归对香港与东南亚关系的影响及对策建议","null","null"
"东南亚","96BZZ014","一般项目","政治学","九十年代东南亚国家政治发展研究","1996-07-01","卓越","厦门大学","985大学、211大学","福建","高等院校、其他学校","九十年代东南亚国家政治发展研究","null","null"
"东南亚","93BSS002","一般项目","世界历史","东南亚华人资本的历史考察","1993-05-27","李国梁","厦门大学南洋研究所","985大学、211大学","福建","高等院校、其他学校","东南亚华侨华人经济简史","null","null"
"东南亚","92AWW004","重点项目","外国文学","世界四大文化与东南亚文学","1992-10-25","梁立基","北京大学东方语言文学系","985大学、211大学","教育部","高等院校、其他学校","世界四大文化与东南亚文学","null","null"
"东南亚","92ASS006","重点项目","世界历史","战后东南亚的历史发展","1992-10-25","贺圣达","云南省社科院东南亚研究所","null","云南","省、市社会科学院","战后东南亚的历史发展","null","null"
"东南亚","91CZS016","青年项目","中国历史","近代中国与东南亚的经济关系","1991-12-31","聂德宁","厦门大学南洋所","985大学、211大学","福建","高等院校、其他学校","近现代中国与东南亚经贸关系史研究","null","null"
"东南亚","91BZW032","一般项目","中国文学","东南亚华文文学论","1991-12-31","杨振昆","云南大学中文系","211大学","云南","高等院校、其他学校","东南亚华文文学论","null","null"
"东南亚","91BSS007","一般项目","世界历史","西方国家对东南亚国家殖民政策比较研究","1991-12-31","孙福生","厦门大学历史系","985大学、211大学","福建","高等院校、其他学校","西方国家对东南亚国家殖民政策比较研究","null","null"
"东南亚","91BJB075","一般项目","应用经济","云南面向东南亚开放研究（西南合作面向东南亚开放子课题）","1991-12-31","郑幼炯","云南省人民政府","null","云南","各级党政机关","云南面向东南亚开放研究（西南合作面向东南亚开放子课题）","null","null"
